{
  "schemaVersion": 1,
  "name": "Alex Example",
  "headline": "Operations leader and systems builder",
  "summary": "Synthetic profile demonstrating evidence-backed career retrieval.",
  "location": "United States",
  "website": "https://example.com",
  "visibility": "public",
  "approvedAt": "2026-09-01T00:00:00Z"
}
